recipe_id,title,current_tags,proposed_additions,high_stakes_confirmed,required_swaps,conflicts,flagged_for_review,low_confidence,rationale,error
33bed6e8-7c6b-4b48-80d0-896298cd4c21,Chocolate Pudding,,vegetarian; nut-free; make-ahead; kid-friendly,vegetarian; nut-free,,,"gluten-free: The biscotti cookie mentioned as a serving suggestion typically contains gluten. The pudding base itself is gluten-free, but if the biscotti is considered part of the recipe, the dish would not qualify. Human review needed to determine whether the accompaniment is part of the recipe or merely optional.",,"vegetarian: No meat, poultry, fish, shellfish, or animal-flesh ingredients; contains eggs and dairy only.; nut-free: No nuts, nut flours, nut butters, or nut oils in any ingredient.; make-ahead: Recipe explicitly instructs to refrigerate at least 4 hours or overnight before serving.; kid-friendly: Chocolate pudding is a mild, sweet, familiar dessert with no alcohol, spice, or strongly pungent ingredients.",
61f57552-8d92-45e2-8ab9-e7c168061704,Crème Anglaise,,vegetarian; gluten-free; nut-free; 5-ingredients; make-ahead,vegetarian; gluten-free; nut-free,,,"easy: Recipe involves tempering eggs (a technique requiring care to avoid curdling the custard), constant stirring to coat the back of a spoon, and an ice bath — these steps disqualify it as novice-friendly under the rules.",,"vegetarian: All ingredients are vegetarian: cream, whole milk, sugar, vanilla, egg yolks — no meat, fish, or hidden animal-flesh ingredients.; gluten-free: No wheat, barley, rye, or gluten-containing derivatives in any ingredient: cream, milk, sugar, vanilla, egg yolks.; nut-free: No nuts, nut flours, nut butters, or nut extracts present; vanilla bean/paste is the only flavoring.; 5-ingredients: Exactly 5 ingredients: cream, whole milk, sugar, vanilla bean/paste, egg yolks. Salt, pepper, water, and oil are excluded per rules.; make-ahead: Recipe explicitly instructs to store covered in the fridge in an airtight container for up to 4 days.",
55caf196-e092-4995-b3dc-8067cbb17212,Crème Brulee,,vegetarian; gluten-free; nut-free; 5-ingredients; make-ahead,vegetarian; gluten-free; nut-free,,,"5-ingredients: The vanilla component is listed as both a vanilla bean AND vanilla bean extract — if counted as two separate ingredients rather than one flavor component, the recipe would have 6 ingredients total. A human editor should confirm the counting convention.",,"vegetarian: All ingredients are vegetarian: heavy cream, vanilla bean, vanilla extract, salt, egg yolks, granulated sugar — no meat, fish, or hidden animal-flesh ingredients.; gluten-free: All five ingredients (heavy cream, vanilla bean/extract, salt, egg yolks, granulated sugar) are naturally gluten-free with no wheat, barley, rye, or derivatives present.; nut-free: No tree nuts, peanuts, nut flours, nut butters, or nut extracts in any ingredient; vanilla bean extract is clearly vanilla, not a nut extract.; 5-ingredients: Exactly 5 ingredients when not counting salt: heavy cream, vanilla bean + vanilla extract (one flavor component), egg yolks, granulated sugar. Salt is excluded per the counting rule.; make-ahead: Recipe explicitly states 'Refrigerate for several hours and up to a couple of days' before the final sugar-brûlée step.",
999526ec-420b-40bb-8a3c-5323c1dd7540,Daniel’s Fudge Pie,,vegetarian; nut-free; holiday; kid-friendly,vegetarian; nut-free,,,"easy: Recipe involves a double boiler, electric mixer, pre-baking a pie crust with pie weights, and timing management (foil removal mid-bake); slightly above basic novice level but borderline — requires human judgment.",,"vegetarian: No meat, poultry, fish, or seafood; contains eggs, butter, and dairy — all allowed for vegetarian.; nut-free: No tree nuts or peanuts in any ingredient; no nut-derived products present.; holiday: Recipe notes explicitly state 'This pie is often baked for our Thanksgiving feast.'; kid-friendly: Recipe notes state this was one of Dan's favorite desserts growing up; mild, sweet chocolate pie with no alcohol or spicy/pungent ingredients.",
3501de8e-f9f5-4a15-b32b-9de4b3ab3a96,Deer Valley Resort Area Chocolate Snowball,,gluten-free; nut-free; vegetarian; make-ahead; holiday,gluten-free; nut-free; vegetarian,,,,,"gluten-free: No wheat, barley, rye, or any flour/grain-based ingredient appears in the recipe; the cake is chocolate, butter, eggs, sugar, and coffee only.; nut-free: No nuts, nut flours, nut butters, or nut-derived ingredients are present in the recipe.; vegetarian: Contains only eggs, dairy, chocolate, coffee, and sugar — no meat, poultry, fish, or hidden animal-flesh ingredients.; make-ahead: Step 4 explicitly states 'Cover and refrigerate at least 8 hours,' making advance preparation a requirement of the recipe.; holiday: Described as a 'showstopper' dessert used for catering events; the 'snowball' presentation with piped cream stars and festive decoration strongly implies a celebratory/holiday context.",
f650f149-9461-4eba-a526-f948ea200740,Fluffy Tapioca Pudding,,vegetarian; gluten-free; nut-free; kid-friendly; make-ahead; no-bake; one-pot,vegetarian; gluten-free; nut-free,,,,,"vegetarian: No meat, poultry, fish, shellfish, or animal-flesh ingredients; contains only tapioca, sugar, egg, milk, and vanilla.; gluten-free: All ingredients (tapioca, sugar, egg, milk, vanilla, salt) are naturally gluten-free with no wheat or gluten derivatives present.; nut-free: No nuts, nut flours, nut butters, or nut-derived ingredients in the recipe.; kid-friendly: Sweet, mild, creamy pudding with no spice, alcohol, or strong flavors; author notes it as a childhood comfort food.; make-ahead: Notes instruct to 'Serve warm or chilled,' implying it can be made in advance and refrigerated.; no-bake: Cooked entirely on the stovetop (saucepan/double boiler); no oven is used.; one-pot: Cooked in a single heavy saucepan or double boiler; the egg white is folded in off-heat in the same vessel.",
9bd201a3-8383-43d5-969b-989c84bf2354,Fresh Apple Cake with Caramel Frosting,,vegetarian; kid-friendly; make-ahead,vegetarian,,,"nut-free: Recipe explicitly includes chopped walnuts both in the batter and as a topping — this recipe is NOT nut-free, flagged in case the tag is ever considered.",,"vegetarian: No meat, poultry, fish, or seafood; contains only eggs, butter, dairy, and plant-based ingredients.; kid-friendly: Sweet apple cake with caramel frosting; mild spices (cinnamon, cloves, nutmeg), no alcohol, familiar and appealing to children.; make-ahead: Cake must cool completely before frosting, and baked cakes of this type store well; caramel frosting can also be made in advance.",
f80639c9-2ef6-4d2c-9279-f1fa66392b1a,Asparagus Bacon Pasta,,,,,,,,,Proposer failed: Extra data: line 22 column 1 (char 705)
8fd69e54-8fba-4f43-a302-69c121898e10,Fresh Strawberry Cupcakes with White Chocolate Frosting,,vegetarian; nut-free; kid-friendly; make-ahead,vegetarian; nut-free,,,,,"vegetarian: No meat, poultry, fish, shellfish, or hidden animal-flesh ingredients; contains eggs and dairy which are permitted.; nut-free: No tree nuts, peanuts, nut flours, nut butters, nut oils, or nut-containing ingredients present anywhere in recipe.; kid-friendly: Sweet strawberry cupcakes with white chocolate frosting — mild, familiar, no alcohol or spicy/pungent ingredients; highly appealing to children.; make-ahead: Step 14 explicitly instructs: 'Cover and refrigerate several hours before using,' indicating the frosting (and assembled cupcakes) are designed to be made in advance.",
3fe2c553-42bb-4062-87a8-eccd5fd05dda,Gingerbread Cake,,vegetarian; nut-free; holiday; kid-friendly; easy,vegetarian; nut-free,,,,,"vegetarian: No meat, fish, or hidden animal-flesh ingredients; contains eggs, butter, and flour only.; nut-free: No nuts, nut flours, nut butters, or nut-derived ingredients present in the recipe.; holiday: Gingerbread is a recognized festive/holiday dish explicitly listed in the holiday tag rules.; kid-friendly: Mild sweet spiced cake with no alcohol, no spicy heat, no pungent ingredients; familiar dessert form appealing to children.; easy: Single-bowl mixing method, ~9 ingredients, one pan, basic techniques (beat, mix, bake), no complex steps.",
c97b57f0-109e-4933-909e-005e8e9a1ff4,Mexican Chocolate Cake,,vegetarian; nut-free; kid-friendly; make-ahead,vegetarian; nut-free,,,gluten-free: Uses a boxed devil's food/dark chocolate fudge cake mix and the pan is dusted with flour — both are typically wheat-based. Gluten-free versions exist but are not specified.,,"vegetarian: No meat, poultry, fish, or seafood present; contains eggs, dairy, and chocolate — all vegetarian-permissible.; nut-free: No tree nuts, peanuts, nut flours, nut butters, or nut-derived ingredients listed anywhere in cake or frosting.; kid-friendly: Sweet chocolate cake with mild cinnamon spice; no alcohol, no strongly bitter or pungent ingredients; described as a beloved birthday cake.; make-ahead: Bundt cake stores well after baking; can be baked, cooled, frosted, and kept in advance without meaningful quality loss.",
7afb899b-831f-4ff2-a4fd-ca0ab501be5d,Italian Panna Cotta with Blackberry Sauce,,gluten-free; no-bake; make-ahead,gluten-free,,,"nut-free: Toasted pistachios are listed as a garnish; while optional ('for garnish'), they are part of the recipe as written, which disqualifies a nut-free tag — but if the garnish is omitted the dish would qualify. Needs human decision on whether optional garnishes count.; kid-friendly: The dish is mild, sweet, and not spicy, but panna cotta is a somewhat sophisticated dessert; pistachios are a nut garnish which may be a concern for children. Borderline — requires human judgment.",,"gluten-free: No wheat, barley, rye, or gluten-containing ingredients present; all components are cream, milk, sugar, gelatin, fruit, and nuts.; no-bake: Panna cotta is set by refrigeration (approx. 3 hours); no oven baking required at any step.; make-ahead: Recipe requires refrigeration for about 3 hours to set, making it inherently a prepare-in-advance dish; panna cotta stores well in fridge.",
e978d182-cd6d-48e6-aa06-2689ba758cab,Julie’s Cookies and Cream Cheesecake,,vegetarian; nut-free; make-ahead; kid-friendly,vegetarian; nut-free,,,,,"vegetarian: No meat, poultry, fish, or seafood; contains eggs and dairy only.; nut-free: No nuts, nut flours, nut butters, or nut-derived ingredients listed.; make-ahead: Instructions explicitly state 'Refrigerate overnight before serving.'; kid-friendly: Cookies and cream cheesecake — sweet, mild, familiar flavor profile with no alcohol or spicy/pungent ingredients.",
9ebb26a6-b17f-43a9-91a8-29dbd182e334,Valentine Favorite Hot Fudge Sauce,,vegetarian; nut-free; holiday; kid-friendly; easy; quick; make-ahead; no-bake,vegetarian; nut-free,,,gluten-free: Semi-sweet chocolate brand is unspecified; some chocolate products contain gluten through additives or cross-contamination. Cook should verify the chosen brand is certified or labeled gluten-free.,,"vegetarian: No meat, poultry, fish, shellfish, or hidden animal-flesh ingredients; contains dairy (butter, cream) which is allowed under vegetarian.; nut-free: No tree nuts, peanuts, nut flours, nut butters, or nut-derived ingredients present.; holiday: Recipe title explicitly includes 'Valentine' tying it to Valentine's Day celebration.; kid-friendly: Sweet chocolate dessert sauce with no spice, alcohol, or strongly pungent ingredients; mild and familiar to children.; easy: Roughly 9 ingredients, basic techniques (melting, whisking, simmering), standard equipment (saucepan, microwave), fewer than 7 steps.; quick: Active cook time is approximately 4-minute simmer plus short cooling; total time well under 30 minutes.; make-ahead: Hot fudge sauce is a condiment that stores well in the refrigerator and can be rewarmed without quality loss.; no-bake: Recipe uses stovetop and microwave only; no oven baking required.",
e55a7da9-28a5-4398-9ff7-aa14e2bbfe49,Light Fudge Frosting,,vegetarian; easy; make-ahead; no-bake; one-pot; kid-friendly,vegetarian,,,"gluten-free: Semisweet chocolate chips/chopped chocolate should be verified as gluten-free by brand, as some contain shared-facility cross-contamination warnings; however no gluten ingredients are listed",,"vegetarian: No meat, poultry, fish, shellfish, or hidden animal-flesh ingredients; contains dairy and no disqualifiers; easy: 6 ingredients, 5 straightforward steps, basic techniques (boiling, stirring, whipping), standard saucepan equipment; make-ahead: Step 3 explicitly instructs to refrigerate until cool before whipping, indicating it can be prepared in advance; no-bake: Recipe uses stovetop only (saucepan) and refrigeration; no oven baking required; one-pot: All cooking done in a single medium saucepan; butter, vanilla, and chocolate are added directly to the same pan; kid-friendly: Sweet chocolate frosting for cupcakes with sprinkles; mild, familiar, no alcohol or spicy ingredients",
a214db29-d11e-4475-a303-c815257a0a09,Matcha Panna Cotta,,gluten-free; nut-free; no-bake; make-ahead; kid-friendly,gluten-free; nut-free,,,"vegetarian: Gelatin sheets are typically derived from animal collagen (pork or beef), which some vegetarians avoid. If strict lacto-ovo vegetarian compliance is required, agar-agar substitution would be needed. Tagging as vegetarian under common usage but flagging for site policy review.",,"gluten-free: All ingredients (milk, cream, sugar, matcha powder, gelatin sheets, vanilla paste, berries) are naturally gluten-free with no wheat, barley, rye, or hidden gluten sources.; nut-free: No tree nuts, peanuts, nut flours, nut butters, or nut oils present in any ingredient.; no-bake: Mixture is heated on stovetop then set by refrigeration; no oven is used at any step.; make-ahead: Recipe requires refrigeration for 4+ hours to set; well-suited to full advance preparation and storage.; kid-friendly: Mild, creamy, lightly sweet dessert with no alcohol, no spice, and familiar flavors; topped with whipped cream and berries.",
b43afb12-af50-4905-a556-9d4337545330,Mini Brownie Cupcakes,,vegetarian; nut-free; kid-friendly; make-ahead,vegetarian; nut-free,,,,,"vegetarian: No meat, poultry, fish, seafood, or hidden animal-flesh ingredients; contains butter and eggs which are permitted.; nut-free: No tree nuts, peanuts, nut flours, nut butters, or nut-derived ingredients present in the recipe.; kid-friendly: Chocolate brownie cupcakes dusted with confectioners sugar — mild, sweet, familiar, no alcohol or adult flavors.; make-ahead: Brownies and dense baked goods hold well after cooling and can be stored without quality loss; batter yields multiple batches suggesting advance preparation.",
78b5f823-fa78-4d05-ab9f-effbbff29f70,Strawberry Shortcakes with White Chocolate Mousse,,vegetarian; nut-free; make-ahead; kid-friendly,vegetarian; nut-free,,,"kid-friendly: Step 5 mentions tossing strawberries with a liqueur; if included in a meaningful quantity, alcohol disqualifies this tag. The type and amount of liqueur is unspecified.",,"vegetarian: No meat, poultry, fish, or seafood; contains dairy (butter, buttermilk, cream) and no animal-flesh ingredients; nut-free: No tree nuts, peanuts, nut flours, nut butters, or nut-derived ingredients present in the recipe; make-ahead: Mousse requires chilling at least 2 hours; shortcakes and macerated strawberries can be prepared in advance; components assemble well ahead of serving; kid-friendly: Sweet dessert with strawberries and white chocolate mousse; mild, familiar flavors appealing to children — though a liqueur is mentioned in step 5 which could disqualify if used in significant quantity",
4285838f-56b6-4aa7-8d5e-b0324175d2fb,Maple Walnut Fondue,,vegetarian; easy; holiday; kid-friendly,vegetarian,,,"nut-free: Recipe explicitly includes chopped toasted walnuts (tree nut), so nut-free cannot apply — flagged to confirm no tag is mistakenly added.; gluten-free: Suggested dippers include gingersnap cookies and cubed gingerbread, which typically contain gluten. White chocolate brand may also vary in GF status. Recipe is ambiguous as written.",,"vegetarian: All ingredients are plant-based or dairy/egg products; no meat, fish, or hidden animal-flesh ingredients.; easy: Simple two-step process (melt in double boiler, stir in remaining ingredients); basic technique, common equipment, ~8 ingredients.; holiday: Fondue is a recognized festive/celebratory dish; maple-walnut flavor profile and suggested dippers (gingerbread, gingersnaps) align strongly with holiday entertaining.; kid-friendly: Sweet white chocolate and maple dessert fondue with mild spices; no alcohol, not spicy, familiar dippers like apples and cookies.",
a7434bdc-64f9-453d-94d9-95e7b498ae20,Olive Oil Cake with Brown Butter Frosting,,vegetarian; nut-free; make-ahead,vegetarian; nut-free,,,"kid-friendly: Recipe contains fresh rosemary as a notable flavoring, which gives the cake a herbal, somewhat sophisticated flavor profile; not clearly disqualifying but uncertain appeal to young children.",,"vegetarian: No meat, poultry, fish, or seafood present; contains eggs, dairy, and plant-based ingredients only.; nut-free: No tree nuts, peanuts, nut flours, nut butters, or nut oils in the ingredient list.; make-ahead: Cake requires 80-minute bake plus full cooling before frosting; baked cakes of this style store well and can be prepared in advance.",
c0c5b3be-d8f9-4c1b-9d06-3bb8184fd20b,Plum cake,,vegetarian; nut-free; easy; kid-friendly,vegetarian; nut-free,,,"dairy-free: Recipe calls for milk (amount fills measuring cup to 1 cup with the egg); a plant-based milk substitute could make it dairy-free, but milk is a named, specified ingredient here — not an unspecified ambiguous one — so swap logic does not auto-apply.",,"vegetarian: No meat, poultry, fish, or seafood present; contains egg and milk but those are permitted.; nut-free: No nuts, nut flours, nut butters, or nut-derived ingredients present.; easy: 9 ingredients, 5 straightforward steps, basic techniques (sifting, mixing, baking), standard equipment (bowl, 13x9 pan).; kid-friendly: Mild, sweet fruit cake with no spice, alcohol, or pungent ingredients; suggested to serve with ice cream.",
dd9ecbee-9e35-47bb-bd33-b1b1bf48da5e,Pumpkin Pie,,vegetarian; nut-free; holiday; kid-friendly,vegetarian; nut-free,,,"gluten-free: The recipe calls for an 'unbaked piecrust' without specifying type; standard piecrust contains wheat flour, making the recipe not gluten-free as written. A certified GF piecrust could make it qualify, but this is a defining structural component, not merely an incidental ingredient, so it requires explicit human review.",,"vegetarian: All ingredients are vegetarian — eggs, dairy, canned pumpkin, spices, sugar, and piecrust contain no meat, poultry, fish, or seafood.; nut-free: No nuts, nut flours, nut butters, or nut-derived ingredients are present in the recipe.; holiday: Step 5 explicitly states 'Mark's favorite pie that I make at Thanksgiving'; pumpkin pie is also a recognized festive dish.; kid-friendly: Pumpkin pie is mild, sweet, familiar, contains no alcohol or spicy heat, and is broadly appealing to children.",
409d0787-a291-49c7-8812-54fcc589be10,Raspberry Sauce,,vegetarian; vegan; dairy-free; gluten-free; nut-free; 5-ingredients; easy; no-bake; make-ahead; kid-friendly,vegetarian; vegan; dairy-free; gluten-free; nut-free,,,,,"vegetarian: All ingredients are plant-based; no meat, fish, gelatin, or hidden animal-flesh ingredients; vegan: No dairy, eggs, honey, or other animal products; raspberries, sugar, and vanilla are all plant-based; dairy-free: No milk, butter, cream, or any dairy product present; gluten-free: No wheat, barley, rye, or gluten-containing ingredients; all three ingredients are naturally gluten-free; nut-free: No tree nuts, peanuts, nut flours, or nut-derived ingredients present; 5-ingredients: Only 3 ingredients: frozen raspberries in syrup, sugar, and vanilla (salt/pepper/water/oil not present); easy: 3 ingredients, ~4 steps, basic techniques (blending, straining); accessible to any novice cook; no-bake: No oven required; recipe is entirely blending, straining, and chilling; make-ahead: Instructions explicitly say 'Chill until ready to use,' indicating advance preparation; kid-friendly: Sweet raspberry sauce with no spice, alcohol, or strong flavors; broadly appealing to children",
e93fd1a4-d8cc-4c90-9073-94e046a9c305,Oma’s Fudge,,vegetarian; holiday; kid-friendly; no-bake; make-ahead,vegetarian,,,"nut-free: Recipe explicitly includes 1 cup chopped walnuts (a tree nut), so nut-free does not apply — flagged in case a nut-free version is ever considered.",,"vegetarian: All ingredients are vegetarian — butter, chocolate chips, evaporated milk, sugar, walnuts, marshmallows, vanilla; no meat, fish, or hidden animal-flesh ingredients.; holiday: Notes explicitly state 'Katie used to love to make this at Christmas time' and fudge is a recognized festive/holiday treat.; kid-friendly: Sweet chocolate fudge with no spice, no alcohol, no strong flavors; notes mention it being a childhood favorite.; no-bake: Recipe uses stovetop only; mixture is poured into a pan to harden/cool — no oven involved.; make-ahead: Fudge is poured into a pan to cool and harden, stores well at room temperature or refrigerated without quality loss.",
518638a7-f4b2-4eb5-81fc-34d99dadf8b0,Pecan Pie,,vegetarian; holiday,vegetarian,,,nut-free: Recipe contains pecans (tree nuts) — definitively NOT nut-free; flagged in case this tag is ever mistakenly applied.,,"vegetarian: No meat, poultry, fish, or seafood; contains eggs, butter, and standard baking ingredients only.; holiday: Notes explicitly state 'One of our standard Thanksgiving pies!' — a recognized festive occasion.",
ce11ffd2-f740-48b6-b1bf-6ee9360f01a2,Avgolemono,,dairy-free; nut-free; one-pot,dairy-free; nut-free,,,"gluten-free: Recipe includes orzo pasta, which is made from wheat — this disqualifies it from gluten-free. No GF alternative is specified.",,"dairy-free: No milk, butter, cream, cheese, or other dairy products appear in the ingredient list; egg yolks are not dairy.; nut-free: No tree nuts, peanuts, nut flours, nut butters, or nut-derived ingredients present.; one-pot: All cooking steps occur in a single large stock pot; the egg-lemon tempering is done in a bowl but is not a cooking vessel.",
830de663-a48c-454b-9c35-a1fc1f4de266,Beef Stroganoff,,nut-free,nut-free,,,"gluten-free: Recipe contains 3 tbsp all-purpose flour (used in the roux) and Worcestershire sauce (some brands contain barley malt). Additionally, the recipe recommends serving with egg noodles. Would require certified GF flour, GF Worcestershire, and GF noodles — too many substitutions needed for a defining technique (the roux), so not auto-tagged.",,"nut-free: No tree nuts, peanuts, nut flours, nut butters, or nut-derived ingredients present in the recipe.",
ba73cde5-be0e-44bc-b638-0201991d667d,Butternut Apple Soup,,nut-free; make-ahead; one-pot; kid-friendly,nut-free,,,"vegetarian: Recipe lists 'chicken broth or vegetable broth' — if vegetable broth is used the recipe is vegetarian, but chicken broth disqualifies it. The choice is left to the cook and not defaulted, so this cannot be confidently tagged without a substitution note; however, since the recipe itself offers vegetable broth as an option, tagging with substitution is appropriate — flagging for human decision on whether to apply the tag with a note to use vegetable broth.",,"nut-free: No nuts, nut flours, nut butters, or nut-derived ingredients appear anywhere in the recipe.; make-ahead: Instructions explicitly note 'Soup is better the next day,' indicating it stores well and is intended to be made ahead.; one-pot: Entire recipe is cooked in a single large saucepan from sauté through simmer and purée.; kid-friendly: Mild, sweet squash-and-apple base; curry powder is listed as 1-2 tsp which is moderate but the overall flavor profile is sweet and familiar; no alcohol or strongly pungent ingredients.",
c6ded6bd-32b5-4d20-9629-65a194fc53b8,Horseradish Cream Sauce,,vegetarian; gluten-free; nut-free; easy; quick; no-bake; holiday; spicy,vegetarian; gluten-free; nut-free,,,make-ahead: Whipped cream sauces can deflate or weep over time; it is unclear from the recipe whether this holds well enough in advance to qualify without explicit make-ahead guidance.,,"vegetarian: All ingredients (cream, mayonnaise, horseradish, Dijon mustard, sugar, salt, pepper) are vegetarian; no meat, fish, or hidden animal-flesh ingredients present.; gluten-free: No wheat, barley, rye, or derivatives; cream, mayonnaise, horseradish, and Dijon mustard are all gluten-free in standard forms.; nut-free: No tree nuts, peanuts, nut flours, nut butters, or nut extracts in any ingredient.; easy: 6 ingredients, 3 steps, basic techniques (whipping cream, folding), no special equipment beyond a hand mixer or whisk.; quick: No cooking required; whipping cream and combining ingredients takes well under 15 minutes total.; no-bake: No oven or heat source used; sauce is assembled cold by whipping and folding.; holiday: Notes explicitly state 'standard accompaniment to our Christmas Eve Prime Rib Dinner,' directly tying the recipe to a holiday.; spicy: ½ cup prepared horseradish is the defining ingredient and provides notable pungent heat.",
