recipe_id,title,current_tags,proposed_additions,high_stakes_confirmed,required_swaps,conflicts,flagged_for_review,low_confidence,rationale,error
__meta__,Tags would be created in DB,,nut-free; no-bake; one-pot; grill-bbq; 5-ingredients; spicy,,,,,,,
1b3cbc71-b95c-4517-aae9-d0c815205047,Spinach & Artichoke Potato Casserole,kid-friendly; quick; vegetarian,nut-free; easy,nut-free,,"quick: Total time includes 10–12 minutes microwaving + cooling time + 10–15 minutes baking, plus mixing — conservatively exceeds 30 minutes when cooling and prep are included.; kid-friendly: No direct disqualifier found; dish is mild and cheesy. Tag appears appropriate and no conflict detected.",gluten-free: The 'Garlic Parmesan Seasoning' is a branded/proprietary blend whose full ingredient list is not provided; some seasoning blends contain maltodextrin or other wheat-derived fillers. Human review of the specific product label is recommended before confirming this tag.,,"nut-free: No tree nuts, peanuts, nut flours, nut butters, or nut-derived ingredients appear anywhere in the recipe.; easy: Fewer than 10 ingredients, basic steps (microwave potatoes, mix, bake), common pantry items; only slight complexity is the stand mixer equipment, but the technique itself is straightforward.",
837ddf98-3627-45fe-94af-be3bb277bf94,Cucumber Tea Sandwiches,,vegetarian; nut-free; no-bake; kid-friendly; holiday,vegetarian; nut-free,,,"make-ahead: The cucumber marinade can be prepared ahead, but the recipe explicitly warns to 'serve within an hour of assembling so bread does not get mushy,' meaning the finished dish cannot be fully made ahead without quality loss.; quick: Prep and assembly are fast, but the cucumber marinade requires a minimum of 20 minutes and up to 2 hours, making total time ambiguous relative to the ≤30-minute threshold.",,"vegetarian: All ingredients are plant-based or dairy — cream cheese, cucumber, radishes, herbs, lemon juice, bread — no meat, fish, or hidden animal-flesh ingredients present.; nut-free: No tree nuts, peanuts, nut flours, nut butters, or nut-derived ingredients in the recipe.; no-bake: Recipe requires no oven baking — assembly only with marinating, mixing, and spreading steps.; kid-friendly: Mild, familiar flavors — cream cheese, cucumber, bread — no spice, alcohol, or pungent ingredients; classic tea sandwich format.; holiday: Recipe notes explicitly state it has been made for 'multiple tea parties, baby showers, and bridal showers,' indicating a recognized celebratory/occasion dish.",
5963fbc1-e10d-47a7-b008-8287c25dda3b,Fillet of Beef on Bruschetta,,nut-free; easy; quick,nut-free,,,"make-ahead: Herb butter can be made ahead, but toasted baguette with beef and watercress does not hold well; partial make-ahead potential is ambiguous.",,"nut-free: No tree nuts or peanuts in any ingredient; herbs, butter, beef, and baguette only.; easy: Few ingredients, simple steps: food processor herb butter, broiler toast, assemble — basic techniques, no complex timing.; quick: Assembly dish using pre-cooked/store-bought beef; active prep and broiling is well under 30 minutes.",
256a7ecf-16c1-4f51-8252-1b0cf49ee7e9,Five Alls Restaurant Summer Dill Dip,,nut-free; easy; make-ahead; no-bake,nut-free,,,vegetarian: Worcestershire sauce typically contains anchovies; brand is unspecified. A vegetarian Worcestershire exists but cannot be assumed.; gluten-free: Worcestershire sauce may contain gluten depending on brand; brand is unspecified and cannot be confirmed gluten-free.,,"nut-free: No nuts, nut flours, nut oils, or nut-derived ingredients present in the recipe.; easy: Only 9 ingredients, single step of combining everything, no cooking technique required.; make-ahead: Instructions explicitly say 'Chill for flavors to blend,' indicating advance preparation improves the dish.; no-bake: No cooking or baking required; recipe is simply combined and chilled.",
36e86757-33b0-4fcf-95a8-e4ad0784fd77,Greek Dip,,vegetarian; gluten-free; nut-free; easy; make-ahead; no-bake; 5-ingredients,vegetarian; gluten-free; nut-free,,,,,"vegetarian: All ingredients are dairy/plant-based (cream cheese, feta, herbs, garlic, olive oil) with no meat, fish, or hidden animal-flesh ingredients.; gluten-free: All ingredients (cream cheese, feta, herbs, garlic, olive oil) are inherently gluten-free; serving suggestions include pita but the dip itself contains no gluten.; nut-free: No nuts, nut flours, nut butters, or nut-containing ingredients present.; easy: 5 core ingredients, single food-processor step, basic technique, no special equipment beyond a food processor.; make-ahead: Recipe explicitly instructs to refrigerate at least 2 hours and notes it is best served after resting; ideal for advance preparation.; no-bake: No cooking or baking required; dip is simply blended and chilled.; 5-ingredients: Core ingredients are cream cheese, feta, oregano, basil, and garlic — exactly 5, not counting olive oil (cooking oil) or the optional sundried tomatoes.",
e95d1ace-7902-4e83-9d68-ef8805fbdbb6,Guacamole,,vegetarian; vegan; dairy-free; gluten-free; nut-free; easy; quick; no-bake; one-pot; spicy,vegetarian; vegan; dairy-free; gluten-free; nut-free,,,,,"vegetarian: All core ingredients are plant-based; no meat, fish, or hidden animal-flesh ingredients present.; vegan: Core recipe contains only avocados, garlic, tomato, salt, cayenne, pepper, lime juice — all plant-based. Optional add-ins like cotija cheese and sour cream are clearly marked optional and not part of the base recipe.; dairy-free: Core recipe contains no dairy; cotija cheese and sour cream are explicitly optional and not part of the base dish.; gluten-free: All core ingredients are naturally gluten-free; no wheat, flour, soy sauce, or other gluten sources present.; nut-free: No tree nuts, peanuts, nut flours, or nut-derived ingredients in the recipe.; easy: Single step: peel, smash, stir. Fewer than 10 core ingredients, basic technique (smashing/mixing), no special equipment required.; quick: One-step preparation with no cook time; total prep time is well under 10 minutes.; no-bake: No oven or heat required; recipe is entirely prepared by smashing and mixing.; one-pot: All ingredients are combined in a single bowl; one-step mixing process.; spicy: Cayenne pepper is listed as a core ingredient; jalapeño and hot sauce are also listed as optional additions.",
774aa6c0-48c9-4d3f-ad15-51f82348c28f,Toll House Pie,,vegetarian; easy; kid-friendly,vegetarian,,,"nut-free: Recipe explicitly includes 1 cup chopped walnuts, disqualifying it from nut-free — flagged in case this tag is ever considered.",,"vegetarian: No meat, poultry, fish, or seafood; contains eggs and dairy (butter) which are permitted under vegetarian rules.; easy: Simple steps: beat eggs, mix dry ingredients, stir in butter/chips/nuts, pour into crust and bake. No advanced techniques, ~8 ingredients, straightforward process.; kid-friendly: Sweet chocolate chip and walnut pie — mild, familiar, dessert format appealing to children; no alcohol, no spicy or pungent ingredients.",
2cff31e2-866c-4437-92da-62017fa07cb2,Christmas Bruschetta,,vegetarian; nut-free; holiday; easy; quick,vegetarian; nut-free,,,"gluten-free: Baguette is the primary serving vessel and is a wheat-based bread — this disqualifies gluten-free unless replaced entirely, but as a defining structural ingredient it cannot simply be swapped out.",,"vegetarian: All ingredients are plant-based or dairy — butter, garlic, artichoke hearts, tomato, scallions, feta, parmesan, baguette — no meat, fish, or hidden animal-flesh ingredients.; nut-free: No tree nuts, peanuts, nut flours, nut butters, or nut-derived ingredients present in the recipe.; holiday: Recipe title explicitly states 'Christmas Bruschetta', tying it directly to a holiday.; easy: Fewer than 10 ingredients, single mixing step plus broiling, basic techniques (spreading, mixing, broiling), standard equipment only.; quick: Recipe involves only quick prep (chopping, mixing) and two short broiler steps — total time well under 30 minutes.",
1f6f19ae-fe43-46b5-83af-d083281086cf,Hummus with Tahini,,vegetarian; vegan; dairy-free; gluten-free; nut-free; easy; make-ahead; no-bake; spicy,vegetarian; vegan; dairy-free; gluten-free; nut-free,,,,,"vegetarian: All ingredients are plant-based; no meat, fish, poultry, or animal-flesh derivatives present.; vegan: All ingredients are plant-based; no dairy, eggs, honey, or other animal products present.; dairy-free: No milk, butter, cheese, cream, or any dairy products in the ingredient list.; gluten-free: All ingredients (chickpeas, tahini, lemon juice, garlic, olive oil, cumin, cayenne, salt, water) are naturally gluten-free with no hidden gluten sources.; nut-free: No tree nuts or peanuts present; tahini is sesame-based, not a nut product.; easy: Fewer than 10 steps, basic blender technique, common pantry ingredients, no special equipment or complex techniques required.; make-ahead: Recipe explicitly instructs to refrigerate a few hours for flavors to meld before serving.; no-bake: Entire recipe is prepared in a blender with no oven or cooking required.; spicy: ½ tsp cayenne pepper is a notable heat-contributing ingredient.",
01653a1e-2969-4d22-ad08-8685d446499a,Lisa Ames’ Greek Dip,,vegetarian; nut-free; easy; quick; make-ahead; no-bake,vegetarian; nut-free,,,gluten-free: Cavendar's Greek Seasoning is a proprietary spice blend; gluten status depends on manufacturer formulation and may vary by lot — cook should confirm the label reads gluten-free before serving to celiac guests,,"vegetarian: All ingredients are dairy-based, plant-based, or spices — no meat, poultry, fish, shellfish, or hidden animal-flesh ingredients present; nut-free: No tree nuts, peanuts, nut flours, nut butters, or nut-containing ingredients present; easy: Single food-processor blend, ~7 ingredients, no complex techniques — approachable for a novice; quick: Only step is blending all ingredients in a food processor; total time is well under 30 minutes; make-ahead: A blended cream cheese/feta dip stores well in the refrigerator without quality loss and is typical party prep-ahead food; no-bake: No oven or heat required; preparation is entirely by food processor blending",
e36b0f9c-7c7f-40a1-8ff3-39a8080765f1,Mahogany Chicken Wings,,dairy-free; nut-free; make-ahead; kid-friendly,dairy-free; nut-free,,,"gluten-free: Recipe calls for 'soy sauce,' which typically contains wheat. Gluten-free tamari could be substituted, but the recipe does not specify; requires human confirmation of which soy sauce to use.",,"dairy-free: No milk, butter, cheese, cream, or any dairy product in the ingredient list.; nut-free: No tree nuts, peanuts, nut flours, nut butters, or nut-derived ingredients present.; make-ahead: Instructions explicitly require refrigerating overnight in the marinade before baking.; kid-friendly: Mild, sweet-savory glazed chicken wings with no heat/spice; familiar finger-food format appealing to children.",
6b983304-34e4-4588-985d-3fb2191bfa3d,Sausage-Filled Mushrooms,,nut-free; easy,nut-free,,,"gluten-free: Jimmy Dean sausage rolls may contain wheat-based fillers or additives; the specific product's GF status cannot be confirmed without label verification, making this a potential celiac safety concern.; spicy: Heat level depends entirely on whether the cook chooses regular or spicy sausage; the recipe does not specify one over the other.",spicy (Recipe offers 'regular or spicy' sausage as an option; spiciness is conditional on cook's choice),"nut-free: No nuts, nut-derived ingredients, or nut oils present in the recipe; easy: Simple steps — sauté, mix, fill, bake — with basic equipment and common ingredients; under 7 steps",
6e286168-0e0e-4f10-971e-565ba083a961,Italian Cannellini Dip,,vegan; vegetarian; dairy-free; gluten-free; nut-free; 5-ingredients; easy; quick; no-bake; make-ahead; one-pot,vegan; vegetarian; dairy-free; gluten-free; nut-free,,,,,"vegan: All ingredients are plant-based: beans, garlic, lemon juice, olive oil, parsley — no animal products; vegetarian: All ingredients are plant-based with no meat, fish, or hidden animal-flesh ingredients; dairy-free: No dairy ingredients of any kind present; gluten-free: All ingredients (beans, garlic, lemon juice, olive oil, parsley) are naturally gluten-free; pita chips mentioned in serving suggestion only, not in the recipe itself; nut-free: No nuts, nut flours, nut butters, or nut oils present; 5-ingredients: Exactly 5 ingredients (cannellini beans, garlic, lemon juice, olive oil, parsley) not counting salt and pepper; easy: 5 ingredients, 1 step (blend in food processor), no special techniques or equipment beyond a food processor; quick: Recipe consists of a single blending step; total time is well under 10 minutes; no-bake: No cooking or baking required; simply blended in a food processor; make-ahead: A blended dip stores well in the refrigerator without quality loss and is a classic make-ahead item; one-pot: Entire recipe prepared in a single food processor bowl",
319c887a-cdb6-43a0-84f5-b7854cdf4a3c,Warmed Goat Cheese with Sundried Tomatoes,,vegetarian; easy; one-pot,vegetarian,,,"nut-free: Recipe explicitly includes pine nuts, which are a tree nut, so nut-free cannot be applied — flagging in case any existing tag is added in error.",,"vegetarian: All ingredients are plant-based or dairy (goat cheese); no meat, fish, or hidden animal-flesh ingredients present.; easy: 7 ingredients, single baking step at 350°F for 10 minutes, basic assembly only — no complex techniques required.; one-pot: Entire dish is assembled and baked in a single baking dish.",
f23c4db2-a82f-4780-a0c3-f84843061ff3,Angel Biscuits,,vegetarian; nut-free; kid-friendly; make-ahead,vegetarian; nut-free,,,,,"vegetarian: No meat, poultry, fish, or seafood; contains butter and buttermilk (dairy allowed for vegetarian); nut-free: No tree nuts, peanuts, nut flours, nut butters, or nut-derived ingredients present; kid-friendly: Mild, sweet, familiar baked good with no spice, alcohol, or strong flavors; noted use for strawberry shortcake; make-ahead: Dough requires at least 1 hour rise time and can be prepared in advance; biscuits are also suitable for storing",
e835540d-434a-4b60-85c7-24df66fc32fa,Artisan No-Knead Crusty Bread,,vegetarian; vegan; dairy-free; nut-free; 5-ingredients; make-ahead,vegetarian; vegan; dairy-free; nut-free,,,"gluten-free: Recipe explicitly calls for bread or all-purpose flour, which contains gluten. No gluten-free flour substitution is indicated.",,"vegetarian: Recipe contains only flour, yeast, salt, and water — no meat, fish, or animal-flesh ingredients.; vegan: Recipe contains only flour, yeast, salt, and water — no dairy, eggs, honey, or other animal products.; dairy-free: Recipe contains only flour, yeast, salt, and water — no milk, butter, cream, or other dairy products.; nut-free: Recipe contains only flour, yeast, salt, and water — no nuts, nut flours, or nut-derived ingredients.; 5-ingredients: Recipe has exactly 4 ingredients (flour, yeast, salt, water); salt and water are excluded from the count per rules, leaving 2 countable ingredients (flour, yeast), well under 5.; make-ahead: Dough must sit 12–18 hours before baking — explicitly a long rest/make-ahead step.",
2f03a518-382d-424a-9aa1-6a96106d2b3b,Best Buttermilk Biscuit Recipe,,vegetarian; gluten-free; nut-free; kid-friendly; make-ahead,vegetarian; gluten-free; nut-free,gluten-free: Use a certified 1:1 gluten-free flour blend in place of the all-purpose flour.,,"easy: Recipe involves laminated-style folding technique (fold in thirds, repeated three times) and use of a pastry blender, which goes beyond basic novice techniques and is a potential disqualifier under the rules.",,"vegetarian: No meat, poultry, fish, or seafood. Contains only flour, leavening, salt, butter, and buttermilk.; gluten-free: Recipe explicitly notes '(can substitute 1:1 GF flour)' for the all-purpose flour.; nut-free: No nuts, nut flours, nut butters, or nut-derived ingredients in the recipe.; kid-friendly: Mild, familiar baked good with no spice, alcohol, or strong flavors — classic appeal for children.; make-ahead: Instructions include an optional 30-minute or longer refrigeration rest for the dough before baking.",
b869a1c6-06e2-4cb5-9a46-e23293692fd0,Cherries and Cream Scones,,vegetarian; nut-free; kid-friendly; easy,vegetarian; nut-free,,,,,"vegetarian: All ingredients are plant-based or dairy — flour, sugar, salt, butter, heavy cream, dried cherries. No meat, fish, or hidden animal-flesh ingredients.; nut-free: No tree nuts, peanuts, nut flours, nut butters, or nut-derived ingredients anywhere in the recipe.; kid-friendly: Sweet baked good with mild, familiar flavors (cherries, cream, sugar); no spice, alcohol, or strong/bitter ingredients.; easy: Fewer than 10 ingredients, basic techniques (mixing, cutting in butter, baking), standard equipment; pastry blender technique is accessible to novices.",
58e2480a-eda7-4a3d-81bf-c49180bf48f8,Popovers (Regular or Gluten-free),,vegetarian; gluten-free; nut-free; kid-friendly; easy,vegetarian; gluten-free; nut-free,gluten-free: Use the specified GF option: 1 cup 1:1 GF flour + ½ cup rice flour in place of all-purpose flour.,,"dairy-free: Recipe contains milk and butter as defining ingredients, so it does not qualify. A dairy-free version would require swapping both, but dairy is central to the dish's structure and flavor — this is not a simple incidental swap.; quick: Total bake time alone is 30–35 minutes (plus prep), which puts the recipe right at or over the 30-minute threshold; cannot confidently tag as Quick.",,"vegetarian: All ingredients are eggs, milk, flour, butter, and salt — no meat, fish, or animal-flesh derivatives.; gluten-free: Recipe explicitly provides a gluten-free variant: '1 cup 1:1 GF flour and ½ cup rice flour' as a direct substitution.; nut-free: No tree nuts, peanuts, nut flours, nut butters, or nut-derived ingredients anywhere in the recipe.; kid-friendly: Mild, simple baked good with no spice, alcohol, or strong flavors; served with butter, jam, or honey — very appealing to children.; easy: Roughly 5 core ingredients, single blender step, standard baking technique; however, requires a popover pan and a two-temperature bake which adds slight complexity.",
c46da3f3-4ddc-4f51-9af7-fe4bb8f3f1f7,Butterscotch Puddings with Whipped Cream and Crushed Toffee*,,vegetarian; make-ahead; kid-friendly,vegetarian,,,gluten-free: Crushed toffee (Garden Gate brand) gluten-free status is unverified; all other ingredients appear GF but this component needs manufacturer confirmation before confidently applying the tag; nut-free: Crushed toffee (Garden Gate brand) ingredients are unknown; some toffee products contain nuts or are processed on shared equipment with nuts,,"vegetarian: No meat, poultry, fish, seafood, or animal-flesh ingredients; contains only dairy, eggs, and plant-derived ingredients; make-ahead: Step 2 instructs to cover and refrigerate for at least 3 hours; pudding is fully prepared in advance before topping; kid-friendly: Mild, sweet butterscotch pudding with whipped cream and toffee; familiar dessert with no spicy, bitter, or strongly pungent elements (Scotch amount is 1 tbsp dispersed across 6 servings, negligible)",
9488a0b4-a3b2-49ea-9393-42340090439a,Gluten Free Lemon Poppyseed Scones,,gluten-free; vegetarian; nut-free; make-ahead; kid-friendly,gluten-free; vegetarian; nut-free,,,,,"gluten-free: Recipe explicitly uses '300 grams gluten free multipurpose flour' and is titled 'Gluten Free Lemon Poppyseed Scones'; vegetarian: All ingredients are vegetarian — butter, buttermilk, egg, flour, sugar, lemon, poppyseeds; no meat, fish, or hidden animal-flesh ingredients; nut-free: No nuts, nut flours, nut butters, or nut-derived ingredients anywhere in the recipe; make-ahead: Step 3 explicitly states dough can be refrigerated 'for at least 10 minutes and up to 12 hours' before baking; kid-friendly: Sweet lemon-glazed scones with mild, familiar flavors; no spice, alcohol, or strongly off-putting ingredients for children",
2be974cf-5b57-4560-9ecc-306984613998,Homemade Corn Tortillas,,gluten-free; vegan; vegetarian; dairy-free; nut-free; 5-ingredients; easy; kid-friendly; one-pot,gluten-free; vegan; vegetarian; dairy-free; nut-free,,,"quick: Each tortilla takes roughly 2 minutes to cook (3 turns × ~30 seconds per side); cooking 18 tortillas sequentially in a single skillet would likely exceed 30 minutes total, but batch size and skillet size could vary — borderline and conservative estimate exceeds the threshold.",,"gluten-free: Recipe explicitly uses 'Maseca gluten free corn masa flour' and water — no other ingredients.; vegan: Only ingredients are corn masa flour and water — no animal products of any kind.; vegetarian: Only ingredients are corn masa flour and water — no meat, fish, or animal-flesh derivatives.; dairy-free: Only ingredients are corn masa flour and water — no dairy products present.; nut-free: Only ingredients are corn masa flour and water — no nuts, nut flours, or nut-derived ingredients.; 5-ingredients: Only 2 ingredients: Maseca gluten free corn masa flour and water (not counting salt, pepper, water, or oil — water here is a primary ingredient but the recipe has only 2 total).; easy: Only 2 ingredients, 2 main steps, basic techniques (mixing dough, pressing, pan-cooking), no special skill required.; kid-friendly: Plain, mild corn tortillas with no spice, alcohol, or strong flavors — highly familiar and appealing to children.; one-pot: Cooked entirely in a single skillet.",
e847d415-04d2-4e60-b519-233a788a9ffa,Julie’s Sunday Rolls,,vegetarian; nut-free; make-ahead; kid-friendly; holiday,vegetarian; nut-free,,,,,"vegetarian: No meat, poultry, fish, or seafood; contains eggs, butter, and milk only.; nut-free: No tree nuts, peanuts, nut flours, nut butters, or nut extracts present in the recipe.; make-ahead: Step 2 explicitly states dough 'can be placed in refrigerator overnight' before shaping and baking.; kid-friendly: Soft, mild, slightly sweet dinner rolls with no spice, alcohol, or strong flavors; notes mention making them every Sunday for the kids.; holiday: Soft homemade rolls are a recognized festive/holiday side dish, and the scale-up note implies large family gatherings.",
07655b58-eb39-4d0a-bc1f-fbdc60ad10a6,Scones,,vegetarian; nut-free; holiday; kid-friendly,vegetarian; nut-free,,,make-ahead: Dough rests for 30 minutes but it is unclear whether the dough can be made significantly in advance and stored without quality loss; fried dough is generally best fresh,,"vegetarian: No meat, poultry, fish, or seafood; contains eggs, powdered milk, oil, flour — all vegetarian-compatible; nut-free: No tree nuts, peanuts, nut flours, nut butters, or nut-derived ingredients present; holiday: Recipe notes explicitly state 'her traditional Halloween night treat!'; kid-friendly: Fried dough sprinkled with powdered sugar — sweet, mild, familiar treat with no spice or alcohol",
2e439b80-5674-4236-bebc-648f20bee89f,Chocolate Sour Cream Cupcakes,,vegetarian; nut-free; kid-friendly; make-ahead,vegetarian; nut-free,,,"holiday: Recipe notes mention a wedding reception, which is a celebration but not a traditional holiday. The recipe itself is not a recognized festive holiday dish — borderline occasion tag requiring human judgment.",,"vegetarian: No meat, poultry, fish, or seafood; contains eggs, dairy, and chocolate — all vegetarian-compatible.; nut-free: No tree nuts, peanuts, nut flours, nut butters, or nut-containing ingredients listed. Nonpareil chocolate candy wafer garnish is decorative candy with no nuts indicated.; kid-friendly: Chocolate cupcakes with sweet fudge frosting; mild, familiar, sweet dessert with no alcohol, spice, or strong flavors.; make-ahead: Frosting requires refrigeration step; cupcakes must cool completely before frosting; baked goods hold well and can be made in advance (as implied by wedding reception batch production in notes).",
3f17ef30-9135-439b-8c47-49edc03862fc,CONDENSEDSOURDOUGHRECIPE/METHODforcrustyartisanloaf,,make-ahead; kid-friendly,,,,"vegetarian: Most sub-recipes appear vegetarian, but the pizza recipe mentions unspecified 'toppings' including 'sauce, cheese, and desired toppings' — toppings are not defined and could include meat. The core dough recipes themselves are vegetarian, but the recipe as a whole is ambiguous due to the pizza instructions.; vegan: Several sub-recipes contain eggs (waffles, sandwich bread) and honey (sandwich bread), and the sourdough artisan loaf could have cheese or other animal-product mix-ins added per instructions. Cannot apply vegan tag.; dairy-free: The recipe explicitly invites adding 'cheeses' as mix-ins, and the pizza recipe calls for cheese as a topping. While the base doughs may be dairy-free, the recipe as written incorporates dairy options, making this ambiguous.; nut-free: The recipe explicitly lists 'nuts' as a suggested mix-in for the artisan loaf, so nut-free cannot be confirmed for the recipe as written.",,"make-ahead: Dough is retarded overnight in the fridge; multiple recipes include overnight/next-morning steps and explicit freeze-and-reheat guidance.; kid-friendly: Mild, non-spicy bread, waffles, and pizza — familiar, crowd-pleasing foods with no alcohol, heat, or strongly bitter/pungent elements.",
